[{"formatVersion":"1.1.0","id":"daily-2026-10-24","title":"Daily Moin","width":6,"height":6,"cells":[{"x":2,"y":5,"kind":"person","facing":"N","needs":1,"role":"fisherman"},{"x":2,"y":3,"kind":"person","facing":"S","needs":1,"role":"kid"},{"x":1,"y":1,"kind":"person","facing":"E","needs":1,"chatterbox":true,"role":"market"},{"x":4,"y":1,"kind":"person","facing":"S","needs":2,"role":"captain"},{"x":4,"y":3,"kind":"person","facing":"E","needs":1,"role":"market"},{"x":5,"y":3,"kind":"fender","slant":"rising"},{"x":5,"y":2,"kind":"person","facing":"N","needs":1,"role":"fisherman"},{"x":5,"y":1,"kind":"person","facing":"N","needs":1,"role":"kid"},{"x":5,"y":0,"kind":"person","facing":"N","needs":1,"role":"market"},{"x":4,"y":0,"kind":"person","facing":"S","needs":1,"role":"fisherman"}],"par":3},{"formatVersion":"1.1.0","id":"daily-2026-12-31","title":"Daily Moin","width":6,"height":6,"cells":[{"x":5,"y":2,"kind":"person","facing":"W","needs":1,"role":"fisherman"},{"x":2,"y":2,"kind":"person","facing":"W","needs":1,"role":"kid"},{"x":0,"y":2,"kind":"person","facing":"E","needs":2,"role":"captain"},{"x":1,"y":2,"kind":"person","facing":"N","needs":1,"role":"market"},{"x":1,"y":0,"kind":"person","facing":"W","needs":1,"role":"fisherman"},{"x":0,"y":0,"kind":"fender","slant":"rising"},{"x":0,"y":1,"kind":"person","facing":"N","needs":1,"role":"kid"},{"x":1,"y":5,"kind":"person","facing":"W","needs":1,"role":"market"},{"x":0,"y":5,"kind":"person","facing":"N","needs":1,"role":"fisherman"},{"x":1,"y":1,"kind":"person","facing":"N","needs":1,"role":"kid"}],"par":3},{"formatVersion":"1.1.0","id":"daily-2027-02-28","title":"Daily Moin","width":6,"height":6,"cells":[{"x":1,"y":4,"kind":"person","facing":"E","needs":1,"role":"fisherman"},{"x":5,"y":4,"kind":"person","facing":"N","needs":1,"role":"kid"},{"x":5,"y":0,"kind":"person","facing":"W","needs":1,"role":"market"},{"x":1,"y":0,"kind":"person","facing":"W","needs":1,"role":"fisherman"},{"x":0,"y":0,"kind":"fender","slant":"rising"},{"x":0,"y":3,"kind":"person","facing":"N","needs":2,"role":"captain"},{"x":1,"y":3,"kind":"person","facing":"S","needs":1,"role":"kid"},{"x":0,"y":2,"kind":"person","facing":"S","needs":1,"role":"market"},{"x":4,"y":2,"kind":"person","facing":"S","needs":1,"role":"fisherman"},{"x":4,"y":4,"kind":"person","facing":"S","needs":1,"role":"kid"},{"x":4,"y":5,"kind":"person","facing":"N","needs":1,"role":"market"}],"par":4}]
