{
  "formatVersion": "1.1.0",
  "id": "ferry-03",
  "title": "Ticket office",
  "width": 7,
  "height": 7,
  "cells": [
    {"x": 0, "y": 0, "kind": "person", "facing": "S", "needs": 2, "role": "captain"},
    {"x": 1, "y": 0, "kind": "person", "facing": "W", "needs": 1, "role": "fisherman"},
    {"x": 2, "y": 0, "kind": "person", "facing": "W", "needs": 1, "role": "market"},
    {"x": 0, "y": 1, "kind": "person", "facing": "N", "needs": 2, "role": "captain"},
    {"x": 2, "y": 1, "kind": "person", "facing": "N", "needs": 1, "role": "kid"},
    {"x": 5, "y": 1, "kind": "fender", "slant": "falling"},
    {"x": 1, "y": 2, "kind": "person", "facing": "S", "needs": 1, "role": "kid"},
    {"x": 4, "y": 2, "kind": "person", "facing": "S", "needs": 1, "role": "fisherman"},
    {"x": 4, "y": 3, "kind": "person", "facing": "S", "needs": 2, "role": "captain"},
    {"x": 1, "y": 4, "kind": "person", "facing": "N", "needs": 1, "role": "fisherman"},
    {"x": 4, "y": 4, "kind": "person", "facing": "N", "needs": 1, "role": "market"},
    {"x": 5, "y": 4, "kind": "person", "facing": "N", "needs": 1, "role": "fisherman"},
    {"x": 1, "y": 6, "kind": "person", "facing": "N", "needs": 1, "role": "market"},
    {"x": 4, "y": 6, "kind": "person", "facing": "N", "needs": 1, "role": "kid"}
  ],
  "par": 6
}
