{
  "formatVersion": "1.0.0",
  "id": "ferry-05",
  "title": "Bow and stern",
  "width": 4,
  "height": 6,
  "cells": [
    {"x": 1, "y": 0, "kind": "person", "facing": "E", "needs": 1, "role": "fisherman"},
    {"x": 2, "y": 0, "kind": "person", "facing": "E", "needs": 2, "role": "captain"},
    {"x": 3, "y": 0, "kind": "person", "facing": "S", "needs": 1, "role": "kid"},
    {"x": 0, "y": 1, "kind": "person", "facing": "E", "needs": 1, "role": "fisherman"},
    {"x": 1, "y": 1, "kind": "fender", "slant": "rising"},
    {"x": 2, "y": 2, "kind": "person", "facing": "S", "needs": 1, "role": "fisherman"},
    {"x": 3, "y": 2, "kind": "fender", "slant": "rising"},
    {"x": 0, "y": 3, "kind": "person", "facing": "N", "needs": 1, "role": "kid"},
    {"x": 0, "y": 4, "kind": "person", "facing": "N", "needs": 1, "role": "fisherman"},
    {"x": 2, "y": 4, "kind": "person", "facing": "N", "needs": 1, "role": "fisherman"},
    {"x": 0, "y": 5, "kind": "person", "facing": "E", "needs": 2, "role": "captain"},
    {"x": 1, "y": 5, "kind": "person", "facing": "W", "needs": 2, "role": "captain"}
  ],
  "par": 5
}
