{
  "formatVersion": "1.1.0",
  "id": "harbour-08",
  "title": "Round the bend",
  "width": 6,
  "height": 5,
  "cells": [
    {"x": 2, "y": 1, "kind": "person", "facing": "E", "needs": 1, "role": "fisherman"},
    {"x": 5, "y": 1, "kind": "fender", "slant": "falling"},
    {"x": 4, "y": 2, "kind": "person", "facing": "E", "needs": 1, "role": "market"},
    {"x": 5, "y": 2, "kind": "person", "facing": "W", "needs": 1, "role": "kid"},
    {"x": 2, "y": 3, "kind": "person", "facing": "S", "needs": 1, "role": "kid"},
    {"x": 3, "y": 3, "kind": "fender", "slant": "falling"},
    {"x": 2, "y": 4, "kind": "person", "facing": "N", "needs": 1, "role": "market"},
    {"x": 3, "y": 4, "kind": "person", "facing": "N", "needs": 1, "role": "fisherman"},
    {"x": 4, "y": 4, "kind": "person", "facing": "E", "needs": 1, "role": "fisherman"},
    {"x": 5, "y": 4, "kind": "person", "facing": "W", "needs": 1, "role": "kid"}
  ],
  "par": 3
}
