{
  "formatVersion": "1.1.0",
  "id": "market-03",
  "title": "Fish stall",
  "width": 5,
  "height": 4,
  "cells": [
    {"x": 0, "y": 0, "kind": "person", "facing": "E", "needs": 2, "role": "captain"},
    {"x": 1, "y": 0, "kind": "person", "facing": "W", "needs": 1, "chatterbox": true, "role": "market"},
    {"x": 2, "y": 0, "kind": "fender", "slant": "rising"},
    {"x": 3, "y": 0, "kind": "person", "facing": "W", "needs": 1, "role": "market"},
    {"x": 0, "y": 1, "kind": "person", "facing": "E", "needs": 1, "role": "fisherman"},
    {"x": 4, "y": 1, "kind": "person", "facing": "N", "needs": 1, "role": "kid"},
    {"x": 2, "y": 2, "kind": "person", "facing": "S", "needs": 1, "role": "market"},
    {"x": 0, "y": 3, "kind": "person", "facing": "N", "needs": 1, "role": "fisherman"},
    {"x": 2, "y": 3, "kind": "fender", "slant": "rising"}
  ],
  "par": 2
}
