{
  "formatVersion": "1.0.0",
  "id": "harbour-03",
  "title": "Two ripples",
  "width": 5,
  "height": 4,
  "cells": [
    {"x": 0, "y": 0, "kind": "person", "facing": "E", "needs": 1},
    {"x": 2, "y": 0, "kind": "person", "facing": "E", "needs": 1, "role": "market"},
    {"x": 4, "y": 0, "kind": "person", "facing": "S", "needs": 1},
    {"x": 0, "y": 3, "kind": "person", "facing": "W", "needs": 1, "role": "kid"},
    {"x": 2, "y": 3, "kind": "person", "facing": "W", "needs": 1},
    {"x": 4, "y": 3, "kind": "person", "facing": "N", "needs": 1}
  ],
  "par": 2
}
