{
  "formatVersion": "1.0.0",
  "id": "harbour-10",
  "title": "Whole harbour awake",
  "width": 6,
  "height": 6,
  "cells": [
    {"x": 0, "y": 0, "kind": "person", "facing": "E", "needs": 1},
    {"x": 5, "y": 0, "kind": "fender", "slant": "falling"},
    {"x": 3, "y": 1, "kind": "seagull"},
    {"x": 0, "y": 2, "kind": "fender", "slant": "rising"},
    {"x": 2, "y": 2, "kind": "person", "facing": "W", "needs": 2, "role": "captain"},
    {"x": 3, "y": 2, "kind": "person", "facing": "N", "needs": 1, "role": "kid"},
    {"x": 5, "y": 2, "kind": "person", "facing": "S", "needs": 1, "role": "market"},
    {"x": 0, "y": 4, "kind": "person", "facing": "N", "needs": 1},
    {"x": 2, "y": 4, "kind": "person", "facing": "N", "needs": 1},
    {"x": 3, "y": 4, "kind": "person", "facing": "W", "needs": 1, "role": "market"},
    {"x": 3, "y": 5, "kind": "person", "facing": "N", "needs": 1, "role": "kid"},
    {"x": 5, "y": 5, "kind": "person", "facing": "W", "needs": 1}
  ],
  "par": 3
}
