{
  "formatVersion": "1.1.0",
  "id": "market-08",
  "title": "The gull at the bakery",
  "width": 4,
  "height": 6,
  "cells": [
    {"x": 0, "y": 0, "kind": "seagull"},
    {"x": 1, "y": 0, "kind": "person", "facing": "S", "needs": 2, "role": "captain"},
    {"x": 1, "y": 1, "kind": "person", "facing": "N", "needs": 2, "chatterbox": true, "role": "captain"},
    {"x": 3, "y": 1, "kind": "person", "facing": "S", "needs": 1, "role": "market"},
    {"x": 0, "y": 2, "kind": "person", "facing": "N", "needs": 1, "role": "fisherman"},
    {"x": 0, "y": 3, "kind": "person", "facing": "N", "needs": 1, "role": "kid"},
    {"x": 0, "y": 5, "kind": "person", "facing": "N", "needs": 1, "role": "market"},
    {"x": 1, "y": 5, "kind": "person", "facing": "W", "needs": 1, "role": "fisherman"},
    {"x": 3, "y": 5, "kind": "person", "facing": "W", "needs": 1, "role": "kid"}
  ],
  "par": 3
}
