{
  "formatVersion": "1.0.0",
  "id": "ferry-07",
  "title": "Foghorn",
  "width": 6,
  "height": 5,
  "cells": [
    {"x": 0, "y": 0, "kind": "person", "facing": "E", "needs": 1, "role": "fisherman"},
    {"x": 4, "y": 0, "kind": "person", "facing": "S", "needs": 2, "role": "captain"},
    {"x": 0, "y": 1, "kind": "person", "facing": "N", "needs": 2, "role": "captain"},
    {"x": 2, "y": 1, "kind": "fender", "slant": "falling"},
    {"x": 3, "y": 1, "kind": "person", "facing": "N", "needs": 1, "role": "kid"},
    {"x": 4, "y": 1, "kind": "fender", "slant": "falling"},
    {"x": 5, "y": 1, "kind": "person", "facing": "S", "needs": 1, "role": "fisherman"},
    {"x": 1, "y": 2, "kind": "person", "facing": "E", "needs": 1, "role": "fisherman"},
    {"x": 2, "y": 2, "kind": "person", "facing": "N", "needs": 1, "role": "kid"},
    {"x": 4, "y": 2, "kind": "person", "facing": "N", "needs": 1, "role": "fisherman"},
    {"x": 5, "y": 2, "kind": "person", "facing": "S", "needs": 1, "role": "fisherman"},
    {"x": 1, "y": 3, "kind": "person", "facing": "N", "needs": 1, "role": "kid"},
    {"x": 3, "y": 3, "kind": "person", "facing": "E", "needs": 1, "role": "fisherman"},
    {"x": 4, "y": 3, "kind": "fender", "slant": "rising"},
    {"x": 5, "y": 3, "kind": "person", "facing": "W", "needs": 1, "role": "fisherman"},
    {"x": 4, "y": 4, "kind": "person", "facing": "N", "needs": 1, "role": "kid"}
  ],
  "par": 4
}
