{
  "formatVersion": "1.0.0",
  "id": "harbour-01",
  "title": "First Moin",
  "width": 4,
  "height": 3,
  "cells": [
    {"x": 0, "y": 1, "kind": "person", "facing": "E", "needs": 1},
    {"x": 1, "y": 1, "kind": "person", "facing": "E", "needs": 1},
    {"x": 3, "y": 1, "kind": "person", "facing": "E", "needs": 1, "role": "kid"}
  ],
  "par": 1
}
